{
  "name": "Elektromehaničar za rashladne i termičke uređaje",
  "description": "Elektromehaničar za rashladne i termičke uređaje obučava učenike za rad sa različitim vrstama rashladnih i klimatskih uređaja, kao i za montažu, održavanje i popravku ovih sistema. Učenici stiču znanja o električnim instalacijama, termalnim procesima i uređajima koji koriste termalne i rashladne sisteme. Ovaj profil pruža praktične veštine za rad u industriji, domaćinstvima i servisima za klimatizaciju i hlađenje.",
  "imagePath": "/images/profiles/elektromehanicar-za-rashladne-i-termicke-uredjaje.jpg",
  "classes": {
    "general": [],
    "specific": []
  }
}
